{
  "schema_version": "0.1.0",
  "metadata": {
    "id": "battle_first_sino_japanese_war_1894_1895",
    "title": "甲午戰爭",
    "created_at": "2026-06-22",
    "updated_at": "2026-06-22",
    "license": "CC BY-SA 4.0",
    "source_system": "ai_extraction_zhwiki"
  },
  "battle": {
    "id": "battle_first_sino_japanese_war",
    "name": "甲午戰爭",
    "also_known_as": [
      "第一次中日戰爭",
      "清日戰爭",
      "日清戰爭"
    ],
    "part_of": "近代東亞戰爭",
    "date": {
      "label": "1894-07-25 – 1895-04-17",
      "start": "1894-07-25",
      "end": "1895-04-17",
      "precision": "range",
      "confidence": 0.95
    },
    "summary": "1894年7月至1895年4月間，清朝與大日本帝國因朝鮮問題爆發的大規模海陸戰爭。戰場主要位於朝鮮半島、遼東半島、膠東半島、黃海、威海及澎湖。戰爭以日本勝利及《馬關條約》簽訂告終。",
    "confidence": 0.85
  },
  "sides": [
    {
      "id": "side_qing",
      "name": "中國（清朝）",
      "color": "#2f6fb5",
      "belligerents": [
        {
          "id": "bel_side_qing",
          "name": "清朝"
        }
      ]
    },
    {
      "id": "side_japan",
      "name": "大日本帝國",
      "color": "#c0392b",
      "belligerents": [
        {
          "id": "bel_side_japan",
          "name": "大日本帝國"
        }
      ]
    }
  ],
  "commanders": [
    {
      "id": "cmd_guangxu",
      "name": "光緒皇帝",
      "side_id": "side_qing",
      "rank_or_role": "清朝皇帝",
      "confidence": 0.86
    },
    {
      "id": "cmd_cixi",
      "name": "慈禧太后",
      "side_id": "side_qing",
      "rank_or_role": "清朝實際最高政治人物之一",
      "confidence": 0.82
    },
    {
      "id": "cmd_li_hongzhang",
      "name": "李鴻章",
      "side_id": "side_qing",
      "rank_or_role": "清方高層決策與外交人物",
      "confidence": 0.9
    },
    {
      "id": "cmd_ding_ruchang",
      "name": "丁汝昌",
      "side_id": "side_qing",
      "rank_or_role": "北洋水師提督",
      "confidence": 0.88
    },
    {
      "id": "cmd_liu_buchan",
      "name": "劉步蟾",
      "side_id": "side_qing",
      "rank_or_role": "北洋水師將領",
      "confidence": 0.8
    },
    {
      "id": "cmd_zuo_baogui",
      "name": "左寶貴",
      "side_id": "side_qing",
      "rank_or_role": "清軍將領",
      "confidence": 0.78
    },
    {
      "id": "cmd_ma_yukun",
      "name": "馬玉崑",
      "side_id": "side_qing",
      "rank_or_role": "清軍將領",
      "confidence": 0.7
    },
    {
      "id": "cmd_song_qing",
      "name": "宋慶",
      "side_id": "side_qing",
      "rank_or_role": "清軍將領",
      "confidence": 0.75
    },
    {
      "id": "cmd_meiji",
      "name": "明治天皇",
      "side_id": "side_japan",
      "rank_or_role": "日本天皇",
      "confidence": 0.86
    },
    {
      "id": "cmd_ito_hirobumi",
      "name": "伊藤博文",
      "side_id": "side_japan",
      "rank_or_role": "日本高層政治人物",
      "confidence": 0.82
    },
    {
      "id": "cmd_yamagata_aritomo",
      "name": "山縣有朋",
      "side_id": "side_japan",
      "rank_or_role": "日本陸軍第1軍相關指揮官",
      "confidence": 0.84
    },
    {
      "id": "cmd_oyama_iwao",
      "name": "大山岩",
      "side_id": "side_japan",
      "rank_or_role": "日本陸軍第2軍相關指揮官",
      "confidence": 0.8
    },
    {
      "id": "cmd_ito_sukeyuki",
      "name": "伊東祐亨",
      "side_id": "side_japan",
      "rank_or_role": "日本聯合艦隊司令",
      "confidence": 0.88
    },
    {
      "id": "cmd_togo_heihachiro",
      "name": "東鄉平八郎",
      "side_id": "side_japan",
      "rank_or_role": "日本海軍將領",
      "confidence": 0.72
    }
  ],
  "actors": [
    {
      "id": "actor_qing_army",
      "name": "清軍",
      "side_id": "side_qing",
      "kind": "army",
      "commander_ids": [
        "cmd_guangxu",
        "cmd_li_hongzhang"
      ],
      "confidence": 0.75,
      "strength": {
        "label": "250,000 personnel",
        "min": 250000,
        "max": 250000,
        "confidence": 0.75
      }
    },
    {
      "id": "actor_beiyang_fleet",
      "name": "北洋水師",
      "side_id": "side_qing",
      "kind": "fleet",
      "commander_ids": [
        "cmd_ding_ruchang",
        "cmd_liu_buchan"
      ],
      "confidence": 0.7
    },
    {
      "id": "actor_huai_army",
      "name": "淮軍",
      "side_id": "side_qing",
      "kind": "army",
      "commander_ids": [
        "cmd_li_hongzhang"
      ],
      "confidence": 0.7
    },
    {
      "id": "actor_xiang_army",
      "name": "湘軍",
      "side_id": "side_qing",
      "kind": "army",
      "commander_ids": [
        "cmd_song_qing"
      ],
      "confidence": 0.7
    },
    {
      "id": "actor_japanese_army",
      "name": "日本陸軍",
      "side_id": "side_japan",
      "kind": "army",
      "commander_ids": [
        "cmd_yamagata_aritomo",
        "cmd_oyama_iwao"
      ],
      "confidence": 0.75,
      "strength": {
        "label": "240,616 personnel",
        "min": 240616,
        "max": 240616,
        "confidence": 0.75
      }
    },
    {
      "id": "actor_japanese_first_army",
      "name": "日本陸軍第1軍",
      "side_id": "side_japan",
      "kind": "army",
      "commander_ids": [
        "cmd_yamagata_aritomo"
      ],
      "confidence": 0.7
    },
    {
      "id": "actor_japanese_second_army",
      "name": "日本陸軍第2軍",
      "side_id": "side_japan",
      "kind": "army",
      "commander_ids": [
        "cmd_oyama_iwao"
      ],
      "confidence": 0.8,
      "strength": {
        "label": "25,000 personnel",
        "min": 25000,
        "max": 25000,
        "confidence": 0.8
      }
    },
    {
      "id": "actor_japanese_combined_fleet",
      "name": "日本聯合艦隊",
      "side_id": "side_japan",
      "kind": "fleet",
      "commander_ids": [
        "cmd_ito_sukeyuki",
        "cmd_togo_heihachiro"
      ],
      "confidence": 0.7
    },
    {
      "id": "actor_japanese_first_flying_squadron",
      "name": "日本聯合艦隊第一游擊隊",
      "side_id": "side_japan",
      "kind": "unit",
      "commander_ids": [],
      "confidence": 0.7
    }
  ],
  "places": [
    {
      "id": "place_korean_peninsula",
      "name": "朝鮮半島",
      "geometry": {
        "type": "Point",
        "coordinates": [
          127.5,
          38.0
        ]
      },
      "precision": "approximate",
      "confidence": 0.65
    },
    {
      "id": "place_liaodong_peninsula",
      "name": "遼東半島",
      "geometry": {
        "type": "Point",
        "coordinates": [
          122.2,
          39.2
        ]
      },
      "precision": "approximate",
      "confidence": 0.65
    },
    {
      "id": "place_shandong_weihai",
      "name": "山東威海",
      "geometry": {
        "type": "Point",
        "coordinates": [
          122.12,
          37.5
        ]
      },
      "precision": "approximate",
      "confidence": 0.75
    },
    {
      "id": "place_yellow_sea",
      "name": "黃海",
      "geometry": {
        "type": "Point",
        "coordinates": [
          123.5,
          36.5
        ]
      },
      "precision": "approximate",
      "confidence": 0.6
    },
    {
      "id": "place_penghu",
      "name": "澎湖群島",
      "geometry": {
        "type": "Point",
        "coordinates": [
          119.57,
          23.57
        ]
      },
      "precision": "approximate",
      "confidence": 0.7
    },
    {
      "id": "place_asan",
      "name": "牙山",
      "geometry": {
        "type": "Point",
        "coordinates": [
          126.98,
          36.79
        ]
      },
      "precision": "approximate",
      "confidence": 0.7
    },
    {
      "id": "place_pungdo",
      "name": "豐島海域",
      "geometry": {
        "type": "Point",
        "coordinates": [
          126.39,
          37.12
        ]
      },
      "precision": "approximate",
      "confidence": 0.65
    },
    {
      "id": "place_seonghwan",
      "name": "成歡",
      "geometry": {
        "type": "Point",
        "coordinates": [
          127.13,
          36.92
        ]
      },
      "precision": "approximate",
      "confidence": 0.65
    },
    {
      "id": "place_pyongyang",
      "name": "平壤",
      "geometry": {
        "type": "Point",
        "coordinates": [
          125.75,
          39.03
        ]
      },
      "precision": "approximate",
      "confidence": 0.8
    },
    {
      "id": "place_yalu_river",
      "name": "鴨綠江",
      "geometry": {
        "type": "LineString",
        "coordinates": [
          [
            124.35,
            40.1
          ],
          [
            124.0,
            39.93
          ],
          [
            123.7,
            39.82
          ]
        ]
      },
      "precision": "approximate",
      "confidence": 0.6
    },
    {
      "id": "place_hushan",
      "name": "虎山",
      "geometry": {
        "type": "Point",
        "coordinates": [
          124.33,
          40.22
        ]
      },
      "precision": "approximate",
      "confidence": 0.6
    },
    {
      "id": "place_jiuliancheng",
      "name": "九連城",
      "geometry": {
        "type": "Point",
        "coordinates": [
          124.34,
          40.17
        ]
      },
      "precision": "approximate",
      "confidence": 0.58
    },
    {
      "id": "place_andong_dandong",
      "name": "安東縣（今丹東）",
      "geometry": {
        "type": "Point",
        "coordinates": [
          124.38,
          40.13
        ]
      },
      "precision": "approximate",
      "confidence": 0.7
    },
    {
      "id": "place_huayuankou",
      "name": "花園口",
      "geometry": {
        "type": "Point",
        "coordinates": [
          122.99,
          39.55
        ]
      },
      "precision": "approximate",
      "confidence": 0.55
    },
    {
      "id": "place_jinzhou_liaoning",
      "name": "金州",
      "geometry": {
        "type": "Point",
        "coordinates": [
          121.72,
          39.1
        ]
      },
      "precision": "approximate",
      "confidence": 0.7
    },
    {
      "id": "place_dalian_bay",
      "name": "大連灣",
      "geometry": {
        "type": "Point",
        "coordinates": [
          121.75,
          39.05
        ]
      },
      "precision": "approximate",
      "confidence": 0.7
    },
    {
      "id": "place_lushun",
      "name": "旅順",
      "geometry": {
        "type": "Point",